{
  "code_version": "ns-observations 1.0.0",
  "created_by": "ns-observations 1.0.0",
  "policy": {
    "eps": 0.0001,
    "estimator": "auto",
    "min_each_outcome": 5,
    "n_boot": 2000,
    "review_alpha": 0.05,
    "review_min_clips": 5,
    "seed": 20261010,
    "target": 0.99,
    "threshold_decimals": 6
  },
  "schema_version": "1.0",
  "species": {
    "Abyssinian Nightjar": {
      "beta0": 3.1589982987070475,
      "beta1": 2.072270314935195,
      "curve_identified": true,
      "diagnostics": {
        "bootstrap_recorder": {
          "cluster": "recorder",
          "labelled_q": [
            0,
            3123,
            4109
          ],
          "n_clusters": 15,
          "n_resamples": 2000,
          "share_with_threshold": 0.9305,
          "status_shares": {
            "accepted": 0.9305,
            "insufficient_validation": 0.0695
          },
          "threshold_ci": [
            0.4706295,
            0.834777
          ]
        },
        "model_free": {
          "correct": 74,
          "validated_above_threshold": 74,
          "wilson_hi": 0.9999999999999998,
          "wilson_lo": 0.9506484964337834
        }
      },
      "gate_reason": null,
      "method": "ml",
      "n_correct": 117,
      "n_incorrect": 33,
      "review_flags": [
        {
          "bonferroni_alpha": 0.0071428571428571435,
          "correct": 0,
          "expected_correct": 4.375076543443517,
          "flag": "recorder_inconsistent_with_pooled_curve",
          "p_value": 0.0025989350201989555,
          "recorder": "RBS75",
          "validated_clips": 10
        },
        {
          "bonferroni_alpha": 0.0071428571428571435,
          "correct": 0,
          "expected_correct": 10.899946328265688,
          "flag": "recorder_inconsistent_with_pooled_curve",
          "p_value": 2.515527445384084e-08,
          "recorder": "RBS79",
          "validated_clips": 19
        }
      ],
      "species": "Abyssinian Nightjar",
      "species_code": "abynig1",
      "status": "accepted",
      "threshold": 0.666639,
      "validated_max": 1.0,
      "validated_min": 0.102
    },
    "African Black-headed Oriole": {
      "beta0": null,
      "beta1": null,
      "curve_identified": false,
      "diagnostics": {
        "model_free": null
      },
      "gate_reason": "no_observed_errors",
      "method": null,
      "n_correct": 150,
      "n_incorrect": 0,
      "review_flags": [],
      "species": "African Black-headed Oriole",
      "species_code": "abhori1",
      "status": "insufficient_validation",
      "threshold": null,
      "validated_max": 0.989,
      "validated_min": 0.104
    },
    "Red-billed Firefinch": {
      "beta0": -1.4577788986162163,
      "beta1": 0.9422955371462722,
      "curve_identified": true,
      "diagnostics": {
        "bootstrap_recorder": {
          "cluster": "recorder",
          "labelled_q": [
            0,
            0,
            0
          ],
          "n_clusters": 22,
          "n_resamples": 2000,
          "share_with_threshold": 0.0055,
          "status_shares": {
            "accepted": 0.0055,
            "insufficient_validation": 0.3605,
            "not_reached": 0.5745,
            "slope_not_positive": 0.0595
          },
          "threshold_ci": null
        },
        "model_free": null
      },
      "gate_reason": null,
      "method": "ml",
      "n_correct": 6,
      "n_incorrect": 95,
      "review_flags": [],
      "species": "Red-billed Firefinch",
      "species_code": "rebfir2",
      "status": "not_reached",
      "threshold": null,
      "validated_max": 0.907,
      "validated_min": 0.101
    },
    "Three-banded Plover": {
      "beta0": null,
      "beta1": null,
      "curve_identified": false,
      "diagnostics": {
        "model_free": null
      },
      "gate_reason": "too_few_errors",
      "method": null,
      "n_correct": 145,
      "n_incorrect": 1,
      "review_flags": [],
      "species": "Three-banded Plover",
      "species_code": "thbplo1",
      "status": "insufficient_validation",
      "threshold": null,
      "validated_max": 0.994,
      "validated_min": 0.102
    }
  },
  "status": "draft",
  "threshold_set_id": "ts-72713aa1dcc77850",
  "validation_snapshot": {
    "n_clips": 547,
    "sha256": "643e6574d4d5b06f31bda29c63c6cfcbaef7b266463002b18381ada7da64a9bb"
  }
}
